{
  "protocol": 3,
  "status": "stable",
  "framing": "newline-delimited-json-rpc-2.0",
  "limits": {
    "max_frame_bytes": 4194304,
    "max_provider_streams": 4,
    "max_in_flight_requests": 64,
    "provider_window_events": 64,
    "provider_window_bytes": 4194304,
    "control_queue_frames": 64,
    "control_queue_bytes": 16777216,
    "data_queue_bytes": 16777220,
    "max_operation_duration_ms": 300000,
    "default_tool_idle_timeout_ms": 90000,
    "max_progress_message_chars": 256,
    "max_progress_message_bytes": 1024,
    "max_progress_frame_bytes": 4096,
    "progress_interval_ms": 250,
    "progress_burst": 4,
    "max_manifest_bytes": 262144,
    "max_capabilities_per_kind": 256,
    "max_name_bytes": 128,
    "max_version_bytes": 64,
    "max_description_bytes": 16384,
    "max_schema_bytes": 65536,
    "max_schema_depth": 32,
    "max_model_tokens": 16777216,
    "max_price_micros_usd": 1000000000000
  },
  "methods": {
    "initialize": "initialize",
    "toolCall": "tool/call",
    "toolProgress": "tool/progress",
    "commandExecute": "command/execute",
    "hookInvoke": "hook/invoke",
    "providerComplete": "provider/complete",
    "providerModels": "provider/models",
    "providerEvent": "provider/event",
    "providerCredit": "provider/credit",
    "providerHttp": "provider/http",
    "providerHttpEvent": "provider/http_event",
    "providerHttpCancel": "provider/http_cancel",
    "eventPublish": "event/publish",
    "eventRead": "event/read",
    "sessionQuery": "session/query",
    "contextRead": "session/context_read",
    "sessionControl": "session/control",
    "sessionToolCall": "session/tool_call",
    "effectToolCall": "effect/tool_call",
    "stateRead": "extension/state_read",
    "stateCommit": "extension/state_commit",
    "injectMessage": "session/inject_message",
    "setStatus": "session/set_status",
    "notify": "ui/notify",
    "publishPanel": "ui/publish_panel",
    "shutdown": "shutdown",
    "exit": "exit"
  },
  "initialize_request": {
    "jsonrpc": "2.0",
    "id": 1,
    "method": "initialize",
    "params": {
      "host": "rottweiler",
      "protocol": 3,
      "max_frame_bytes": 4194304,
      "capabilities": [
        "provider-models",
        "provider-http"
      ]
    }
  },
  "initialize_response": {
    "jsonrpc": "2.0",
    "id": 1,
    "result": {
      "name": "wire-fixture-v3",
      "version": "1.0.0",
      "protocol": 3,
      "capabilities": {
        "providers": [
          {
            "alias-prefix": "fixture-v3/",
            "capabilities": [
              "models"
            ],
            "credential-references": [
              "fixture-token"
            ]
          }
        ]
      }
    }
  },
  "provider_models_request": {
    "jsonrpc": "2.0",
    "id": 2,
    "method": "provider/models",
    "params": {
      "alias_prefix": "fixture-v3/"
    }
  },
  "provider_models_response": {
    "jsonrpc": "2.0",
    "id": 2,
    "result": {
      "models": [
        {
          "id": "vision-thinking",
          "display_name": "Vision Thinking",
          "capabilities": {
            "structured_output": "unsupported",
            "tool_calling": true,
            "vision": true,
            "thinking": true,
            "cache_breakpoints": "explicit"
          },
          "max_context_tokens": 200000,
          "max_output_tokens": 16000,
          "pricing": {
            "input_per_million_micros_usd": 3000000,
            "output_per_million_micros_usd": 15000000,
            "cache_read_per_million_micros_usd": 300000,
            "cache_write_per_million_micros_usd": 3750000
          }
        }
      ]
    }
  },
  "provider_http_request": {
    "jsonrpc": "2.0",
    "id": "plugin-http-1",
    "method": "provider/http",
    "params": {
      "alias": "fixture-v3/vision-thinking",
      "invocation_id": 9,
      "credential_reference": "fixture-token",
      "request": {
        "method": "POST",
        "url": "https://api.example.test/v1/complete",
        "headers": [
          {
            "name": "content-type",
            "value": "application/json"
          }
        ],
        "body_base64": "e30=",
        "credential_header": "authorization",
        "credential_prefix": "Bearer "
      }
    }
  },
  "provider_http_head": {
    "jsonrpc": "2.0",
    "method": "provider/http_event",
    "params": {
      "request_id": "plugin-http-1",
      "event": {
        "type": "head",
        "status": 200,
        "headers": [
          [
            "content-type",
            "text/event-stream"
          ]
        ]
      }
    }
  },
  "provider_http_body": {
    "jsonrpc": "2.0",
    "method": "provider/http_event",
    "params": {
      "request_id": "plugin-http-1",
      "event": {
        "type": "body",
        "data_base64": "ZGF0YToge30K"
      }
    }
  },
  "provider_http_finished": {
    "jsonrpc": "2.0",
    "method": "provider/http_event",
    "params": {
      "request_id": "plugin-http-1",
      "event": {
        "type": "finished"
      }
    }
  },
  "$comment": "@generated by cargo xtask codegen; do not edit by hand.",
  "tool_call_request": {
    "jsonrpc": "2.0",
    "id": 17,
    "method": "tool/call",
    "params": {
      "name": "work",
      "input": {},
      "lifetime": {
        "total_ms": 300000,
        "idle_ms": 90000
      }
    }
  },
  "tool_progress": {
    "jsonrpc": "2.0",
    "method": "tool/progress",
    "params": {
      "request_id": 17,
      "sequence": 1,
      "progress": {
        "message": "working",
        "amount": {
          "completed": 1,
          "total": 2
        }
      }
    }
  }
}
